{
    "$schema": "../theme.schema.json",
    "name": "Modern",
    "description": "A contemporary theme featuring large images and a card-based layout ideal for visual newsletters.",
    "version": "1.0.0",
    "configuration": {
        "posts_per_page": {
            "type": "number",
            "default": 20,
            "header": "Posts per page",
            "description": "Number of posts to display per page"
        },
        "dark_mode": {
            "type": "boolean",
            "default": false,
            "header": "Dark mode",
            "description": "Match your reader's system dark mode preference"
        },
        "color-accent": {
            "type": "color",
            "default": "#0069FF",
            "header": "Accent color",
            "description": "Primary accent color"
        },
        "color-accent-dark": {
            "type": "color",
            "default": "#4A9EFF",
            "header": "Accent color (dark mode)",
            "description": "Primary accent color for dark mode"
        },
        "font-body": {
            "type": "font",
            "default": "Source Serif 4",
            "header": "Body font",
            "description": "Font family for body text"
        },
        "font-accent": {
            "type": "font",
            "default": "Hex Franklin",
            "header": "Accent font",
            "description": "Font family for headings and accents"
        },
        "color-background": {
            "type": "color",
            "default": "#FAFAFA",
            "header": "Background color",
            "description": "Page background color"
        },
        "color-background-dark": {
            "type": "color",
            "default": "#1A1A1E",
            "header": "Background color (dark mode)",
            "description": "Page background color for dark mode"
        },
        "blockquote_style": {
            "type": "select",
            "default": "card",
            "header": "Blockquote style",
            "description": "Visual style for blockquote text",
            "options": [
                { "id": "card", "label": "Card" },
                { "id": "bar", "label": "Bar" },
                { "id": "editorial", "label": "Editorial" }
            ]
        }
    }
}
