{
    "name": "Classic",
    "description": "A traditional, clean theme with a simple list layout perfect for text-focused newsletters.",
    "version": "1.0.0",
    "configuration": {
        "posts_per_page": {
            "type": "number",
            "default": 20,
            "header": "Posts per page",
            "description": "Number of posts to display per page"
        },
        "color-accent": {
            "type": "color",
            "default": "#0069FF",
            "header": "Accent color",
            "description": "Primary accent color for light mode"
        },
        "color-accent-dark": {
            "type": "color",
            "default": "#4A9EFF",
            "header": "Accent color (dark mode)",
            "description": "Primary accent color for dark mode"
        },
        "font-body": {
            "type": "font",
            "default": "Source Serif 4",
            "header": "Body font",
            "description": "Font family for body text"
        },
        "font-accent": {
            "type": "font",
            "default": "Hex Franklin",
            "header": "Accent font",
            "description": "Font family for headings and accents"
        },
        "font-size-blockquote": {
            "type": "select",
            "default": "20px",
            "header": "Blockquote font size",
            "description": "Font size for blockquote text",
            "options": [
                { "id": "14px", "label": "Small" },
                { "id": "16px", "label": "Medium" },
                { "id": "20px", "label": "Large" }
            ]
        }
    }
}
